{
  "$schema": "http://json-schema.org/draft-07/schema#",
  "$id": "https://kanecta.org/specification/kanecta-metadata-v1",
  "title": "Kanecta Item Metadata",
  "description": "Schema for a Kanecta metadata.json file. Stored at .kanecta/data/{shard1}/{shard2}/{uuid}/metadata.json for items, and .kanecta/types/{shard1}/{shard2}/{uuid}/metadata.json for type definition records.",
  "type": "object",
  "required": ["id", "parentId", "value", "type", "owner", "createdAt", "modifiedAt"],
  "additionalProperties": false,
  "properties": {
    "id": {
      "type": "string",
      "description": "UUID of this item."
    },
    "parentId": {
      "type": ["string", "null"],
      "description": "UUID of the parent item. Root item points to itself. Null for type definition records."
    },
    "value": {
      "type": ["string", "null"],
      "description": "Primary content or label of the item."
    },
    "type": {
      "type": "string",
      "description": "Item type. One of the VALID_TYPES values for regular items, or 'type' for type definition records."
    },
    "typeId": {
      "type": ["string", "null"],
      "description": "UUID of the custom type definition. Set for items of type 'object'. Null otherwise."
    },
    "owner": {
      "type": "string",
      "description": "Owner identifier (e.g. an email address or domain)."
    },
    "license": {
      "type": ["string", "null"],
      "description": "License identifier for this item's content (e.g. 'CC-BY-4.0'). Null if not set."
    },
    "sortOrder": {
      "type": ["number", "null"],
      "description": "Numeric sort position among siblings. Null for type definition records."
    },
    "confidence": {
      "type": ["string", "null"],
      "enum": [null, "experimental", "exploring", "decided", "locked", "low", "medium", "high", "verified"],
      "description": "Confidence level of the item's content."
    },
    "status": {
      "type": ["string", "null"],
      "description": "Arbitrary status string (e.g. 'active', 'archived', 'draft'). Null if not set."
    },
    "tags": {
      "type": "array",
      "items": { "type": "string" },
      "description": "Tags associated with this item."
    },
    "createdAt": {
      "type": "string",
      "format": "date-time",
      "description": "ISO 8601 timestamp when this item was created."
    },
    "modifiedAt": {
      "type": "string",
      "format": "date-time",
      "description": "ISO 8601 timestamp when this item was last modified."
    },
    "createdBy": {
      "type": ["string", "null"],
      "description": "Identifier of the actor who created this item."
    },
    "modifiedBy": {
      "type": ["string", "null"],
      "description": "Identifier of the actor who last modified this item."
    },
    "cachedAt": {
      "type": ["string", "null"],
      "format": "date-time",
      "description": "ISO 8601 timestamp when remote content was last cached locally."
    },
    "subscribedAt": {
      "type": ["string", "null"],
      "format": "date-time",
      "description": "ISO 8601 timestamp when this item subscribed to a remote source."
    },
    "subscriptionSource": {
      "type": ["string", "null"],
      "description": "URI of the remote source this item subscribes to."
    }
  },
  "examples": [
    {
      "id": "a1b2c3d4-e5f6-7890-abcd-ef1234567890",
      "parentId": "00000000-0000-0000-0000-000000000001",
      "value": "Richie Thomas",
      "type": "object",
      "typeId": "f1e2d3c4-b5a6-7890-abcd-ef1234567890",
      "owner": "richardsempire@gmail.com",
      "license": null,
      "sortOrder": 0,
      "confidence": "decided",
      "status": "active",
      "tags": ["people", "team"],
      "createdAt": "2025-01-01T00:00:00.000Z",
      "modifiedAt": "2025-06-01T00:00:00.000Z",
      "createdBy": "richardsempire@gmail.com",
      "modifiedBy": "richardsempire@gmail.com",
      "cachedAt": null,
      "subscribedAt": null,
      "subscriptionSource": null
    },
    {
      "id": "f1e2d3c4-b5a6-7890-abcd-ef1234567890",
      "parentId": null,
      "value": "Person",
      "type": "type",
      "typeId": null,
      "owner": "richardsempire@gmail.com",
      "license": null,
      "sortOrder": null,
      "confidence": null,
      "status": null,
      "tags": [],
      "createdAt": "2025-01-01T00:00:00.000Z",
      "modifiedAt": "2025-01-01T00:00:00.000Z",
      "createdBy": "richardsempire@gmail.com",
      "modifiedBy": "richardsempire@gmail.com",
      "cachedAt": null,
      "subscribedAt": null,
      "subscriptionSource": null
    }
  ]
}
