{
  "id": "d4f0dd1e-3d79-4eb2-9f67-668d59e9d554",
  "parentId": null,
  "value": "Skill Example",
  "type": "type",
  "typeId": null,
  "owner": "richardsempire@gmail.com",
  "license": null,
  "sortOrder": 107,
  "confidence": null,
  "status": null,
  "tags": [],
  "createdAt": "2026-06-06T21:49:01.000Z",
  "modifiedAt": "2026-06-06T21:49:01.000Z",
  "createdBy": "richardsempire@gmail.com",
  "modifiedBy": "richardsempire@gmail.com",
  "cachedAt": null,
  "subscribedAt": null,
  "subscriptionSource": null
}