{
  "id": "88657248-047c-4734-983c-7535e3342ffb",
  "parentId": null,
  "value": "API Endpoint",
  "type": "type",
  "typeId": null,
  "owner": "RicThomas@linz.govt.nz",
  "license": null,
  "sortOrder": 13,
  "confidence": null,
  "status": null,
  "tags": [],
  "createdAt": "2026-05-28T02:03:35.819Z",
  "modifiedAt": "2026-05-28T02:03:35.819Z",
  "createdBy": "RicThomas@linz.govt.nz",
  "modifiedBy": "RicThomas@linz.govt.nz",
  "cachedAt": null,
  "subscribedAt": null,
  "subscriptionSource": null
}