{
  "id": "f5d047d0-d2e6-4d4d-8c62-2586d19d48be",
  "parentId": null,
  "value": "Pipeline Sequence Step",
  "type": "type",
  "typeId": null,
  "owner": "richardsempire@gmail.com",
  "license": null,
  "sortOrder": 113,
  "confidence": null,
  "status": null,
  "tags": [],
  "createdAt": "2026-06-06T21:49:01.000Z",
  "modifiedAt": "2026-06-06T21:49:01.000Z",
  "createdBy": "richardsempire@gmail.com",
  "modifiedBy": "richardsempire@gmail.com",
  "cachedAt": null,
  "subscribedAt": null,
  "subscriptionSource": null
}