{
  "id": "e9fb4cf7-1284-42ae-8c88-9c491260605d",
  "parentId": null,
  "value": "Bug",
  "type": "type",
  "typeId": null,
  "owner": "richardsempire@gmail.com",
  "license": null,
  "sortOrder": 20,
  "confidence": null,
  "status": null,
  "tags": [],
  "createdAt": "2026-05-28T02:03:36.070Z",
  "modifiedAt": "2026-05-28T02:03:36.070Z",
  "createdBy": "richardsempire@gmail.com",
  "modifiedBy": "richardsempire@gmail.com",
  "cachedAt": null,
  "subscribedAt": null,
  "subscriptionSource": null
}