{
  "id": "f1a00014-b45e-4c3d-9e7f-000000000001",
  "parentId": "f1a00012-b45e-4c3d-9e7f-000000000001",
  "value": "For UI work: run the dev server and test in a browser",
  "type": "string",
  "typeId": null,
  "owner": "richardsempire@gmail.com",
  "license": null,
  "sortOrder": 1,
  "confidence": null,
  "tags": [],
  "createdAt": "2026-01-01T00:00:00.000Z",
  "modifiedAt": "2026-01-01T00:00:00.000Z",
  "createdBy": "richardsempire@gmail.com",
  "modifiedBy": "richardsempire@gmail.com",
  "cachedAt": null,
  "subscribedAt": null,
  "subscriptionSource": null
}
