{
  "id": "f1a00001-b45e-4c3d-9e7f-000000000001",
  "parentId": "fb0c1d0c-65d4-4d54-995a-b9f80d3223c3",
  "value": "Base Work Process",
  "type": "text",
  "typeId": null,
  "owner": "richardsempire@gmail.com",
  "license": null,
  "sortOrder": 0,
  "confidence": null,
  "tags": [],
  "createdAt": "2026-01-01T00:00:00.000Z",
  "modifiedAt": "2026-01-01T00:00:00.000Z",
  "createdBy": "richardsempire@gmail.com",
  "modifiedBy": "richardsempire@gmail.com",
  "cachedAt": null,
  "subscribedAt": null,
  "subscriptionSource": null
}
