{
  "id": "c44fd723-c7dc-436d-9d43-3ba6ade9e5b9",
  "parentId": null,
  "value": "Action",
  "type": "type",
  "typeId": null,
  "owner": "richardsempire@gmail.com",
  "license": null,
  "sortOrder": 32,
  "confidence": null,
  "status": null,
  "tags": [],
  "createdAt": "2026-05-28T02:03:36.483Z",
  "modifiedAt": "2026-05-28T02:03:36.483Z",
  "createdBy": "richardsempire@gmail.com",
  "modifiedBy": "richardsempire@gmail.com",
  "cachedAt": null,
  "subscribedAt": null,
  "subscriptionSource": null
}