{
  "id": "618be574-97d2-41d4-ad77-fc71f14402f4",
  "parentId": "00000000-0000-0000-0000-000000000000",
  "value": "system_root",
  "type": "system_root",
  "typeId": null,
  "owner": "richardsempire@gmail.com",
  "license": null,
  "sortOrder": 0,
  "confidence": null,
  "tags": [],
  "createdAt": "2026-05-16T23:51:52.582Z",
  "modifiedAt": "2026-05-16T23:51:52.582Z",
  "createdBy": "richardsempire@gmail.com",
  "modifiedBy": "richardsempire@gmail.com",
  "cachedAt": null,
  "subscribedAt": null,
  "subscriptionSource": null
}
