{
  "id": "355125cf-9d78-4939-92a8-26176764e5c3",
  "parentId": null,
  "value": "ADR",
  "type": "type",
  "typeId": null,
  "owner": "richardsempire@gmail.com",
  "license": null,
  "sortOrder": 16,
  "confidence": null,
  "status": null,
  "tags": [],
  "createdAt": "2026-05-28T02:03:35.931Z",
  "modifiedAt": "2026-05-28T02:03:35.931Z",
  "createdBy": "richardsempire@gmail.com",
  "modifiedBy": "richardsempire@gmail.com",
  "cachedAt": null,
  "subscribedAt": null,
  "subscriptionSource": null
}