{
  "id": "83be9b1b-48f5-4e49-b12f-b68ee888c3bd",
  "parentId": null,
  "value": "Goal Key Result",
  "type": "type",
  "typeId": null,
  "owner": "richardsempire@gmail.com",
  "license": null,
  "sortOrder": 101,
  "confidence": null,
  "status": null,
  "tags": [],
  "createdAt": "2026-06-06T21:49:01.000Z",
  "modifiedAt": "2026-06-06T21:49:01.000Z",
  "createdBy": "richardsempire@gmail.com",
  "modifiedBy": "richardsempire@gmail.com",
  "cachedAt": null,
  "subscribedAt": null,
  "subscriptionSource": null
}