{
  "id": "f1a0000f-b45e-4c3d-9e7f-000000000001",
  "parentId": "f1a0000e-b45e-4c3d-9e7f-000000000001",
  "value": "Work task by task; mark each complete as you go",
  "type": "string",
  "typeId": null,
  "owner": "richardsempire@gmail.com",
  "license": null,
  "sortOrder": 0,
  "confidence": null,
  "tags": [],
  "createdAt": "2026-01-01T00:00:00.000Z",
  "modifiedAt": "2026-01-01T00:00:00.000Z",
  "createdBy": "richardsempire@gmail.com",
  "modifiedBy": "richardsempire@gmail.com",
  "cachedAt": null,
  "subscribedAt": null,
  "subscriptionSource": null
}
