{
  "id": "f290f7ab-7c0a-4943-9b29-9e23b7a1bc81",
  "parentId": null,
  "value": "Database Table Column",
  "type": "type",
  "typeId": null,
  "owner": "richardsempire@gmail.com",
  "license": null,
  "sortOrder": 122,
  "confidence": null,
  "status": null,
  "tags": [],
  "createdAt": "2026-06-06T21:49:01.000Z",
  "modifiedAt": "2026-06-06T21:49:01.000Z",
  "createdBy": "richardsempire@gmail.com",
  "modifiedBy": "richardsempire@gmail.com",
  "cachedAt": null,
  "subscribedAt": null,
  "subscriptionSource": null
}