{
  "id": "a28275ab-79a3-4b71-a663-3ff2d577d6e4",
  "parentId": null,
  "value": "Release",
  "type": "type",
  "typeId": null,
  "owner": "richardsempire@gmail.com",
  "license": null,
  "sortOrder": 18,
  "confidence": null,
  "status": null,
  "tags": [],
  "createdAt": "2026-05-28T02:03:36.002Z",
  "modifiedAt": "2026-05-28T02:03:36.002Z",
  "createdBy": "richardsempire@gmail.com",
  "modifiedBy": "richardsempire@gmail.com",
  "cachedAt": null,
  "subscribedAt": null,
  "subscriptionSource": null
}