{
  "id": "b2626c46-8fa4-4748-92ca-2619901c1e9a",
  "parentId": "00000000-0000-0000-0000-000000000000",
  "value": "component_root",
  "type": "component_root",
  "typeId": null,
  "owner": "richardsempire@gmail.com",
  "license": null,
  "sortOrder": 2,
  "confidence": null,
  "tags": [],
  "createdAt": "2026-05-16T23:51:52.583Z",
  "modifiedAt": "2026-05-16T23:51:52.583Z",
  "createdBy": "richardsempire@gmail.com",
  "modifiedBy": "richardsempire@gmail.com",
  "cachedAt": null,
  "subscribedAt": null,
  "subscriptionSource": null
}
